{"schema_version":"1.0.0","dataset":"market-summary","generated_at":"2026-10-22T21:03:43.216621Z","run_id":"39853657538-1","data_window":{"start":"2026-10-16","end":"2026-10-22"},"coverage":{"sources":[{"source":"adzuna","status_last_run":"ok","last_success_at":"2026-10-22T21:03:40.227238Z","records_last_run":441,"jobs_in_history":1708},{"source":"greenhouse","status_last_run":"ok","last_success_at":"2026-10-22T21:03:40.227238Z","records_last_run":69,"jobs_in_history":81},{"source":"gupy","status_last_run":"ok","last_success_at":"2026-10-22T21:03:40.227238Z","records_last_run":259,"jobs_in_history":321},{"source":"lever","status_last_run":"ok","last_success_at":"2026-10-22T21:03:40.227238Z","records_last_run":58,"jobs_in_history":75}],"observations":2007,"note":"Amostra das fontes e termos configurados no JobRadar; não representa o mercado inteiro. Tendências consideram o volume coletado por período."},"data":{"totals":{"observed":2007,"active":1982,"status_unknown":0,"closed":25,"new_7d":2007,"new_30d":2007,"cross_source_duplicates":178},"by_modality":[{"value":"nao_informada","jobs":1362,"pct":67.9},{"value":"remoto","jobs":274,"pct":13.7},{"value":"hibrido","jobs":207,"pct":10.3},{"value":"presencial","jobs":164,"pct":8.2}],"by_seniority":[{"value":"nao_informada","jobs":761,"pct":37.9},{"value":"senior","jobs":612,"pct":30.5},{"value":"pleno","jobs":248,"pct":12.4},{"value":"lideranca","jobs":179,"pct":8.9},{"value":"junior","jobs":135,"pct":6.7},{"value":"estagio","jobs":72,"pct":3.6}],"by_family":[{"value":"outra","jobs":1187,"pct":59.1},{"value":"analise_dados","jobs":372,"pct":18.5},{"value":"engenharia_dados","jobs":324,"pct":16.1},{"value":"governanca_qualidade","jobs":46,"pct":2.3},{"value":"analytics_engineering","jobs":44,"pct":2.2},{"value":"desenvolvimento_dados","jobs":34,"pct":1.7}],"by_source":[{"value":"adzuna","jobs":1546,"pct":77.0},{"value":"gupy","jobs":306,"pct":15.2},{"value":"greenhouse","jobs":81,"pct":4.0},{"value":"lever","jobs":74,"pct":3.7}],"by_state":[{"value":"SP","jobs":800,"pct":39.9},{"value":"nao_informada","jobs":444,"pct":22.1},{"value":"RJ","jobs":114,"pct":5.7},{"value":"RS","jobs":85,"pct":4.2},{"value":"MG","jobs":84,"pct":4.2},{"value":"PR","jobs":72,"pct":3.6},{"value":"SC","jobs":70,"pct":3.5},{"value":"DF","jobs":70,"pct":3.5},{"value":"CE","jobs":53,"pct":2.6},{"value":"PE","jobs":47,"pct":2.3}],"quality":{"runs":27,"failed_runs":2,"records_collected":15574,"records_invalid":0,"invalid_rate_pct":0.0,"missing_published_at_pct":0.0,"missing_company_pct":8.7},"last_successful_run":{"run_id":"39853657538-1","status":"sucesso","finished_at":"2026-10-22T21:03:40.227238Z"}}}